{
  "$schema": "https://json-schema.org/draft/2020-12/schema",
  "$id": "https://raw.githubusercontent.com/wilanis/wilanis-js/main/packages/core/schemas/graph.schema.json",
  "title": "graph",
  "description": "Behaviour as dataflow. A node runs when every value it reads has settled and every node it names under after has answered; list order carries no meaning. Node types are documents of their own: @wilanis/node/run, switch, map. Reconvergence happens at out.from: one node, or an ordered list of candidates each behind a switch.",
  "type": "object",
  "properties": {
    "$schema": {
      "description": "The kind of this document: its published schema URL, or the alias @wilanis/graph.schema.json.",
      "enum": [
        "https://raw.githubusercontent.com/wilanis/wilanis-js/main/packages/core/schemas/graph.schema.json",
        "@wilanis/graph.schema.json"
      ]
    },
    "description": {
      "description": "What this graph answers, in one or two sentences, so a reader knows it without reading its nodes.",
      "type": "string",
      "minLength": 1
    },
    "label": {
      "description": "A short human name for this document, shown wherever a reader sees it instead of its path. Absent: the file name stands in.",
      "type": "string",
      "minLength": 1
    },
    "atomic": {
      "description": "Every effect this graph reaches runs in one transaction on one connection: its answer commits, a refusal or a fault rolls back. Absent: false, and each effect commits on its own.",
      "type": "boolean"
    },
    "reads": {
      "description": "The reads this graph takes from the context: local name -> the resolver that declares it, as @feature/edge/file.resolvers.json#name. The body reads each as {{name}} or {{name.field}}; every entry is read by some value, and no name is a node's id or a reserved root. Data graphs only: a domain graph never reads the context.",
      "type": "object",
      "minProperties": 1,
      "propertyNames": {
        "$ref": "common.schema.json#/$defs/ident"
      },
      "additionalProperties": {
        "$ref": "common.schema.json#/$defs/resolverRef"
      }
    },
    "constants": {
      "description": "Typed literals, read as {{const.name}}.",
      "type": "object",
      "propertyNames": {
        "$ref": "common.schema.json#/$defs/ident"
      },
      "additionalProperties": {
        "type": "object",
        "properties": {
          "type": {
            "$ref": "common.schema.json#/$defs/type"
          },
          "value": {
            "description": "The literal itself, which must conform to the type declared beside it (G013)."
          },
          "description": {
            "description": "What this constant is for, for a reader deciding whether to read it.",
            "type": "string"
          }
        },
        "required": [
          "type",
          "value"
        ],
        "additionalProperties": false
      }
    },
    "in": {
      "description": "What the graph takes: a shape, read as {{in.field}}, or any other type (a list, a scalar), read whole as {{in}}. Absent: takes nothing.",
      "$ref": "common.schema.json#/$defs/typeRef"
    },
    "out": {
      "description": "What the graph answers: the type, and the node it comes from. A graph with no out answers nothing.",
      "type": "object",
      "properties": {
        "type": {
          "$ref": "common.schema.json#/$defs/typeRef"
        },
        "from": {
          "description": "The node whose answer this graph gives, or several as alternatives where a switch decides which settles (G010).",
          "oneOf": [
            {
              "$ref": "common.schema.json#/$defs/ident"
            },
            {
              "type": "array",
              "items": {
                "$ref": "common.schema.json#/$defs/ident"
              },
              "minItems": 1,
              "uniqueItems": true
            }
          ]
        },
        "description": {
          "description": "What the answer means, for a reader of the binding or trigger that receives it.",
          "type": "string"
        }
      },
      "required": [
        "type",
        "from"
      ],
      "additionalProperties": false
    },
    "nodes": {
      "description": "The nodes of the dataflow. A node runs when every value it reads has settled and every node it names under after has answered, so list order carries no meaning.",
      "type": "array",
      "minItems": 1,
      "items": {
        "description": "One node. type names the node schema the rest of the object is judged by.",
        "type": "object",
        "properties": {
          "type": {
            "description": "Which kind of node this is: run to call an operation, switch to route, map to run over a list.",
            "enum": [
              "@wilanis/node/run.schema.json",
              "@wilanis/node/switch.schema.json",
              "@wilanis/node/map.schema.json"
            ]
          }
        },
        "required": [
          "type"
        ],
        "allOf": [
          {
            "if": {
              "properties": {
                "type": {
                  "description": "Selects the run node's own rules for a node of that type.",
                  "const": "@wilanis/node/run.schema.json"
                }
              }
            },
            "then": {
              "$ref": "node/run.schema.json"
            }
          },
          {
            "if": {
              "properties": {
                "type": {
                  "description": "Selects the switch node's own rules for a node of that type.",
                  "const": "@wilanis/node/switch.schema.json"
                }
              }
            },
            "then": {
              "$ref": "node/switch.schema.json"
            }
          },
          {
            "if": {
              "properties": {
                "type": {
                  "description": "Selects the map node's own rules for a node of that type.",
                  "const": "@wilanis/node/map.schema.json"
                }
              }
            },
            "then": {
              "$ref": "node/map.schema.json"
            }
          }
        ]
      }
    }
  },
  "required": [
    "$schema",
    "description",
    "nodes"
  ],
  "additionalProperties": false
}
