{
  "$schema": "https://raw.githubusercontent.com/wilanis/wilanis-js/main/packages/core/schemas/graph.schema.json",
  "label": "Remove customers",
  "description": "Domain graph behind DELETE /customers. It takes the list of ids itself: one removal per id, all at once, and the graph answers only when every one of them has settled. A missing customer refuses the whole batch; the list answered keeps the order asked.",
  "in": "string[]",
  "out": {
    "type": "@customers/domain/Customer.shape.json[]",
    "from": "removed"
  },
  "nodes": [
    {
      "type": "@wilanis/node/map.schema.json",
      "id": "removed",
      "label": "Remove each customer",
      "description": "customer.remove once per id; the element is the id itself",
      "run": "@customers/domain/customer.port.json#remove",
      "over": "{{in}}",
      "bind": {
        "id": ""
      }
    }
  ]
}
