{
  "$schema": "https://raw.githubusercontent.com/wilanis/wilanis-js/main/packages/core/schemas/graph.schema.json",
  "label": "Require a signed-in caller",
  "description": "Anyone our token names is allowed; no token is anonymous.",
  "in": "@access/domain/PrincipalGate.shape.json",
  "out": {
    "type": "@access/domain/Grant.shape.json",
    "from": [
      "granted",
      "anonymous"
    ]
  },
  "nodes": [
    {
      "type": "@wilanis/node/switch.schema.json",
      "id": "anyoneThere",
      "label": "Is anyone there?",
      "in": {
        "principal": "{{in.principal}}"
      },
      "rules": [
        {
          "when": "has(principal)",
          "to": "granted"
        }
      ],
      "else": "anonymous"
    },
    {
      "type": "@wilanis/node/run.schema.json",
      "id": "granted",
      "label": "Allowed",
      "run": "@std/object.port.json#make",
      "in": {
        "value": {
          "allowed": true
        },
        "type": "@access/domain/Grant.shape.json"
      }
    },
    {
      "type": "@wilanis/node/run.schema.json",
      "id": "anonymous",
      "label": "No caller",
      "run": "@std/outcome.port.json#refuse",
      "in": {
        "reason": "anonymous",
        "message": "sign in first: no token was presented",
        "type": "@access/domain/Grant.shape.json"
      }
    }
  ]
}
