{
  "$schema": "https://raw.githubusercontent.com/wilanis/wilanis-js/main/packages/core/schemas/graph.schema.json",
  "label": "Get what is kept",
  "description": "Data graph behind customer.get under the local profile: one record by its key. Absence is answered as `record` absent rather than as a failure, so the switch routes on it and the refusal is a case this graph named.",
  "in": "@customers/domain/CustomerRef.shape.json",
  "out": {
    "type": "@customers/domain/Customer.shape.json",
    "from": [
      "customer",
      "noCustomer"
    ]
  },
  "nodes": [
    {
      "type": "@wilanis/node/run.schema.json",
      "id": "stored",
      "label": "Read the record",
      "run": "@storage/store.port.json#get",
      "in": {
        "store": "@customers/data/customers.store.json",
        "collection": "customers",
        "key": "{{in.id}}"
      }
    },
    {
      "type": "@wilanis/node/switch.schema.json",
      "id": "isKept",
      "label": "Is it kept?",
      "in": {
        "record": "{{stored.record}}"
      },
      "rules": [
        {
          "when": "has(record)",
          "to": "customer"
        }
      ],
      "else": "noCustomer"
    },
    {
      "type": "@wilanis/node/run.schema.json",
      "id": "customer",
      "label": "The record",
      "run": "@std/object.port.json#make",
      "in": {
        "value": "{{stored.record}}",
        "type": "@customers/domain/Customer.shape.json"
      }
    },
    {
      "type": "@wilanis/node/run.schema.json",
      "id": "noCustomer",
      "label": "No such customer",
      "run": "@std/outcome.port.json#refuse",
      "in": {
        "reason": "missing",
        "message": "no customer {{in.id}}",
        "type": "@customers/domain/Customer.shape.json"
      }
    }
  ]
}
