{
  "$schema": "https://raw.githubusercontent.com/wilanis/wilanis-js/main/packages/core/schemas/graph.schema.json",
  "label": "Update what is kept",
  "description": "Data graph behind customer.update under the local profile: change the fields the caller gave and leave the rest. A patch never touches the key, and a key nothing is kept under is answered as absent. The same graph as @customers/data/kept-update.graph.json, against the store kept in PostgreSQL: a store is named statically at a call site, so pointing these at another connection is a copy until a profile may swap one.",
  "in": "@customers/domain/CustomerUpdate.shape.json",
  "out": {
    "type": "@customers/domain/Customer.shape.json",
    "from": [
      "row",
      "missing"
    ]
  },
  "nodes": [
    {
      "type": "@wilanis/node/run.schema.json",
      "id": "asked",
      "label": "Change the record",
      "run": "@storage/store.port.json#patch",
      "in": {
        "store": "@customers/data/customers-postgres.store.json",
        "collection": "customers",
        "key": "{{in.id}}",
        "changes": {
          "name": "{{in.name}}",
          "email": "{{in.email}}",
          "tier": "{{in.tier}}"
        }
      }
    },
    {
      "type": "@wilanis/node/switch.schema.json",
      "id": "route",
      "label": "Was it there?",
      "in": {
        "record": "{{asked.record}}"
      },
      "rules": [
        {
          "when": "has(record)",
          "to": "row"
        }
      ],
      "else": "missing"
    },
    {
      "type": "@wilanis/node/run.schema.json",
      "id": "row",
      "label": "The record",
      "run": "@std/object.port.json#make",
      "in": {
        "value": "{{asked.record}}",
        "type": "@customers/domain/Customer.shape.json"
      }
    },
    {
      "type": "@wilanis/node/run.schema.json",
      "id": "missing",
      "label": "No such customer",
      "run": "@std/outcome.port.json#refuse",
      "in": {
        "reason": "missing",
        "message": "no customer {{in.id}}",
        "type": "@customers/domain/Customer.shape.json"
      }
    }
  ]
}
